{
  "$schema": "https://ps-wiki.github.io/schema/v1/term.schema.json",
  "id": "dynamic-study-model",
  "title": "Dynamic Study Model",
  "description": "A common dynamic model of the Continental European power system used for multi-TSO simulation studies.",
  "language": "en",
  "tags": [
    "stability",
    "europe",
    "entsoe"
  ],
  "related": [],
  "breaking": false,
  "dates": {
    "created": "2025-11-28",
    "last_modified": "2025-11-28"
  },
  "authors": [
    {
      "name": "Jinning Wang",
      "url": "https://jinningwang.github.io"
    }
  ],
  "content": {
    "sections": [
      {
        "order": 1,
        "id": "definition-by-entso-e",
        "title": "Definition by ENTSO-E",
        "type": "definition",
        "source_keys": [
          "entsoe2015dsm"
        ],
        "page": "p3",
        "body_md": "> The main target of the Dynamic Study Model was to setup a robust, simple, transparent and easily transferable dynamic model able to reproduce the same results with a high variety of dynamic simulation tools available and in use at the different CE TSOs.\n> \n> For this purpose a load-flow model of the CE-system was expanded with standard models for generators and appropriate controller models in order to represent the dynamics of the interconnected CE power system. With defined criteria it is possible to choose, which generators should be taken into account for dynamic analysis. The following Figure 1.1 shows the concept of the Dynamic Study Model.\n",
        "figures": [
          {
            "path": "/assets/img/pswiki/dynamic-study-model.png",
            "caption_md": "Fig. 1.1: The concept of the Dynamic Study Model (from <d-cite key=\"entsoe2015dsm\"></d-cite>)",
            "alt": "Fig. 1.1: The concept of the Dynamic Study Model",
            "zoomable": true,
            "source_keys": [
              "entsoe2015dsm"
            ]
          }
        ]
      }
    ]
  }
}
