{
  "$schema": "https://ps-wiki.github.io/schema/v1/term.schema.json",
  "id": "resource-scheduling-commitment",
  "title": "Resource Scheduling & Commitment",
  "description": "Security-constrained resource commitment program used for Day-ahead Market scheduling.",
  "language": "en",
  "tags": [
    "system-operator",
    "pjm",
    "market",
    "reserve"
  ],
  "related": [],
  "breaking": false,
  "dates": {
    "created": "2025-03-15",
    "last_modified": "2025-06-19"
  },
  "authors": [
    {
      "name": "Jinning Wang",
      "url": "https://jinningwang.github.io"
    }
  ],
  "content": {
    "sections": [
      {
        "order": 1,
        "id": "definition-by-pjm",
        "title": "Definition by PJM",
        "type": "definition",
        "source_keys": [
          "pjm2024m11"
        ],
        "page": "p143, Revision 134",
        "body_md": "> The PJM Energy Market Technical Software is a set of computer programs, which performs a security-constrained resource commitment and economic dispatch for the Day-ahead Market. The individual programs are:\n>\n> - Resource Scheduling & Commitment (RSC) – RSC performs **security-constrained resource commitment** based on generation offers, Demand Resource offers, demand bids, Day-ahead Reserve offers, increment offers, decrement bids and transaction schedules submitted by participants and based on PJM RTO reliability requirements. RSC enforces physical resource specific constraints that are specified in the generation offer data and generic transmission constraints that are entered by the Market Operator. RSC provides an optimized economic resource **commitment schedule** for the next forty-eight (48) hours and it utilizes a mixed integer linear programming solver to create an initial resource dispatch for the next Operating Day.\n> - Scheduling, Pricing and Dispatch (SPD) — Performs security-constrained economic dispatch using the commitment profile produced by RSC. SPD calculates hourly unit generation MW levels and LMPs for all load and generation buses for each hour of the next operating day.\n> - Study Network Analysis (STNET) — Creates a powerflow model for each hour of the next operating day based on the scheduled network topology, the generation and demand MW profile produced by SPD and the scheduled Tie Flow with adjacent Balancing Authorities. STNET performs AC contingency analysis using the contingency list from PJM EMS and creates generic constraints based on any violations that are detected.\n"
      }
    ]
  }
}
