{
  "$schema": "https://ps-wiki.github.io/schema/v1/term.schema.json",
  "id": "security-constrained-unit-commitment",
  "title": "Security Constrained Unit Commitment",
  "description": "Optimization that determines generating unit commitment schedules subject to security constraints.",
  "language": "en",
  "tags": [
    "system-operator",
    "nyiso"
  ],
  "related": [],
  "breaking": false,
  "dates": {
    "created": "2025-03-15",
    "last_modified": "2025-06-22"
  },
  "authors": [
    {
      "name": "Jinning Wang",
      "url": "https://jinningwang.github.io"
    }
  ],
  "content": {
    "sections": [
      {
        "order": 1,
        "id": "definition-by-nyiso",
        "title": "Definition by NYISO",
        "type": "definition",
        "source_keys": [
          "nyiso2024dayahead"
        ],
        "page": "p8, Version 8.0",
        "body_md": "> The SCUC produces the generating unit commitment schedule and Firm Transaction schedules for the next day’s operation. Factors considered by SCUC are:\n>\n> - Current generating unit operating status\n> - Constraints on the minimum up and down time of the generators\n> - Generation and start up bid prices\n> - Plant-related startup and shutdown constraints\n> - Minimum and maximum generation constraints\n> - Generation and reserve requirements\n> - Transmission facility maintenance schedules\n> - Transmission constraints\n> - Phase angle regulator settings\n> - Transaction bids\n> - Minimum and Maximum Energy Level constraints (for Energy Storage Resources (ESR) only)\n> - Bid Beginning Energy Level for ESR (for ISO Managed ESR only)\n> - Co-located Storage Resources (CSR) Scheduling Limits (Only for solar/wind Intermittent Power Resource (IPR) and ESR Generators that participate in a CSR). Aggregations comprised of ESR, Wind, or Solar only are not eligible to participate in a CSR.\n"
      }
    ]
  }
}
