{
  "$schema": "https://ps-wiki.github.io/schema/v1/term.schema.json",
  "id": "transmission-planning-horizon",
  "title": "Transmission Planning Horizon",
  "description": "Transmission planning period.",
  "language": "en",
  "tags": [
    "horizon",
    "transmission",
    "nerc"
  ],
  "related": [],
  "breaking": false,
  "dates": {
    "created": "2025-03-15",
    "last_modified": "2025-06-20"
  },
  "authors": [
    {
      "name": "Jinning Wang",
      "url": "https://jinningwang.github.io"
    }
  ],
  "content": {
    "sections": [
      {
        "order": 1,
        "id": "definition-by-nerc",
        "title": "Definition by NERC",
        "type": "definition",
        "source_keys": [
          "nerc2024glossary"
        ],
        "page": null,
        "body_md": "> Near-Term Transmission Planning Horizon is the transmission planning period that covers Year One through five.\n\n> Long-Term Transmission Planning Horizon is the transmission planning period that covers years six through ten or beyond when required to accommodate any known longer lead time projects that may take longer than ten years to complete.\n"
      }
    ]
  }
}
