{
  "$schema": "https://ps-wiki.github.io/schema/v1/term.schema.json",
  "id": "generalized-short-circuit-ratio",
  "title": "Generalized Short-Circuit Ratio",
  "description": "Generalized representation of SCR for single-infeed systems in multi-infeed power electronic configurations.",
  "language": "en",
  "tags": [
    "stability"
  ],
  "related": [
    "grid-strength",
    "stability",
    "short-circuit-ratio",
    "composite-short-circuit-ratio",
    "short-circuit-ratio-with-interaction-factors"
  ],
  "breaking": false,
  "dates": {
    "created": "2025-11-29",
    "last_modified": "2025-11-29"
  },
  "authors": [
    {
      "name": "Jinning Wang",
      "url": "https://jinningwang.github.io"
    }
  ],
  "content": {
    "sections": [
      {
        "order": 1,
        "id": "definition-in-an-article",
        "title": "Definition in an Article",
        "type": "definition",
        "source_keys": [
          "dong2019small"
        ],
        "page": null,
        "body_md": "> In other words, the small signal stability of the MIPES depends on the strength of the weakest equivalent SIPES, which can be quantified with the minimum eigenvalue $\\lambda_1$ of matrix $Y_{eq}$ (extended admittance matrix).\n"
      }
    ]
  }
}
