{
  "$schema": "https://ps-wiki.github.io/schema/v1/term.schema.json",
  "id": "bulk-electric-system",
  "title": "Bulk Electric System",
  "description": "BES. Transmission Elements and Power resources 100 kV or higher.",
  "language": "en",
  "tags": [
    "entity",
    "transmission",
    "nerc"
  ],
  "related": [],
  "breaking": false,
  "dates": {
    "created": "2025-03-15",
    "last_modified": "2025-06-20"
  },
  "authors": [
    {
      "name": "Jinning Wang",
      "url": "https://jinningwang.github.io"
    }
  ],
  "content": {
    "sections": [
      {
        "order": 1,
        "id": "definition-by-nerc",
        "title": "Definition by NERC",
        "type": "definition",
        "source_keys": [
          "nerc2024glossary"
        ],
        "page": null,
        "body_md": "> Unless modified by the lists shown below, all Transmission Elements operated at **100 kV or higher** and Real Power and Reactive Power resources connected at 100 kV or higher. This **does not** include facilities used in the local distribution of electric energy.\n\nMore details of inclusion and exclusion can be found in the source document.\n"
      }
    ]
  }
}
