{
  "$schema": "https://ps-wiki.github.io/schema/v1/term.schema.json",
  "id": "interruptible-demand",
  "title": "Interruptible Demand",
  "description": "Customer demand that can be interrupted by control or request of the system operator.",
  "language": "en",
  "tags": [
    "reliability",
    "nerc"
  ],
  "related": [],
  "breaking": false,
  "dates": {
    "created": "2025-03-15",
    "last_modified": "2025-06-20"
  },
  "authors": [
    {
      "name": "Jinning Wang",
      "url": "https://jinningwang.github.io"
    }
  ],
  "content": {
    "sections": [
      {
        "order": 1,
        "id": "definition-by-nerc",
        "title": "Definition by NERC",
        "type": "definition",
        "source_keys": [
          "nerc2024glossary"
        ],
        "page": null,
        "body_md": "> Customer demand that, in accordance with contractual arrangements, can be interrupted by direct control of the system operator or by action of the customer at the direct request of the system operator.\n"
      }
    ]
  }
}
