{
  "$schema": "https://ps-wiki.github.io/schema/v1/term.schema.json",
  "id": "frequency-deviation",
  "title": "Frequency Deviation",
  "description": "A change in Interconnection frequency.",
  "language": "en",
  "tags": [
    "frequency-control",
    "interconnection",
    "nerc"
  ],
  "related": [],
  "breaking": false,
  "dates": {
    "created": "2025-03-15",
    "last_modified": "2025-06-20"
  },
  "authors": [
    {
      "name": "Jinning Wang",
      "url": "https://jinningwang.github.io"
    }
  ],
  "content": {
    "sections": [
      {
        "order": 1,
        "id": "definition-by-nerc",
        "title": "Definition by NERC",
        "type": "definition",
        "source_keys": [
          "nerc2024glossary"
        ],
        "page": null,
        "body_md": "> A change in Interconnection frequency.\n"
      }
    ]
  }
}
