{
  "$schema": "https://ps-wiki.github.io/schema/v1/term.schema.json",
  "id": "subsynchronous-oscillation",
  "title": "Subsynchronous Oscillation",
  "description": "SSO.",
  "language": "en",
  "tags": [
    "stability"
  ],
  "related": [
    "oscillation",
    "subsynchronous-resonance"
  ],
  "breaking": false,
  "dates": {
    "created": "2026-01-18",
    "last_modified": "2026-01-18"
  },
  "authors": [
    {
      "name": "Jinning Wang",
      "url": "https://jinningwang.github.io"
    }
  ],
  "content": {
    "sections": [
      {
        "order": 1,
        "id": "defintion-in-an-article",
        "title": "Defintion in an Article",
        "type": "definition",
        "source_keys": [
          "ieee1985terms"
        ],
        "page": null,
        "body_md": "> Subsynchronous oscillation is an electric power system condition where the electric network exchanges significant energy with a turbine-generator at one or more of the natural frequencies of the combined system below the synchronous frequency of the system following a disturbance from equilibrium. The above excludes the rigid body modes of the turbine-generator rotors.\n"
      }
    ]
  }
}
