{
  "$schema": "https://ps-wiki.github.io/schema/v1/term.schema.json",
  "id": "financial-transmission-right",
  "title": "Financial Transmission Right",
  "description": "FTR. Compensation contract for transmission charges due to grid congestion.",
  "language": "en",
  "tags": [
    "market",
    "ferc"
  ],
  "related": [],
  "breaking": false,
  "dates": {
    "created": "2025-03-15",
    "last_modified": "2025-06-18"
  },
  "authors": [
    {
      "name": "Jinning Wang",
      "url": "https://jinningwang.github.io"
    }
  ],
  "content": {
    "sections": [
      {
        "order": 1,
        "id": "definition-by-ferc",
        "title": "Definition by FERC",
        "type": "definition",
        "source_keys": [
          "ferc2020glossary"
        ],
        "page": null,
        "body_md": "> A financial transmission right (FTR) is a financial instrument that entitles the holder to receive or pay compensation for transmission charges that arise when grid congestion causes price differences due to the redispatch of generators. FTRs are used to hedge against congestion costs in the transmission system.\n"
      }
    ]
  }
}
