{
  "$schema": "https://ps-wiki.github.io/schema/v1/term.schema.json",
  "id": "capacity-markets",
  "title": "Capacity Markets",
  "description": "A market for trading capacity credits.",
  "language": "en",
  "tags": [
    "market",
    "ferc"
  ],
  "related": [],
  "breaking": false,
  "dates": {
    "created": "2025-03-15",
    "last_modified": "2025-06-20"
  },
  "authors": [
    {
      "name": "Jinning Wang",
      "url": "https://jinningwang.github.io"
    }
  ],
  "content": {
    "sections": [
      {
        "order": 1,
        "id": "definition-by-ferc",
        "title": "Definition by FERC",
        "type": "definition",
        "source_keys": [
          "ferc2020glossary"
        ],
        "page": null,
        "body_md": "> A market for the trading of capacity credits (the ability to produce electricity in the market area during a defined period) usually between parties obligated to deliver electricity to customers and power plant owners.\n"
      }
    ]
  }
}
