{
  "$schema": "https://ps-wiki.github.io/schema/v1/term.schema.json",
  "id": "resonance-stability",
  "title": "Resonance Stability",
  "description": "The behavior of power systems under oscillatory energy exchange conditions.",
  "language": "en",
  "tags": [
    "resonance",
    "stability",
    "power-systems",
    "article"
  ],
  "related": [],
  "breaking": false,
  "dates": {
    "created": "2025-03-15",
    "last_modified": "2025-06-19"
  },
  "authors": [
    {
      "name": "Jinning Wang",
      "url": "https://jinningwang.github.io"
    }
  ],
  "content": {
    "sections": [
      {
        "order": 1,
        "id": "definition-in-an-article-by-a-task-force",
        "title": "Definition in an Article by a Task Force",
        "type": "definition",
        "source_keys": [
          "hatziargyriou2021stability"
        ],
        "page": null,
        "body_md": "> The resonance, in general, occurs when energy exchange takes place periodically in an oscillatory manner. These oscillations grow in case of insufficient dissipation of energy in the flow path and are manifested (in electrical power systems) in magnification of voltage/current/torque magnitudes. When these magnitudes exceed specified thresholds, it is said that a resonance instability has occurred. The term resonance stability encompasses [subsynchronous resonance (SSR)](/wiki/subsynchronous-resonance), whether it be associated with an electromechanical resonance or an entirely electrical resonance.\n> The term SSR, as defined in the original publications related to this phenomenon, can manifest in two possible forms: (i) due to a resonance between series compensation and the mechanical torsional frequencies of the turbine-generator shaft, and (ii) due to a resonance between series compensation and the electrical characteristics of the generator. The first of these occurs between the series compensated electrical network and the mechanical modes of torsional oscillations on the turbine-generator shaft, while the second is a purely electrical resonance and termed Induction Generator Effect (IGE).\n> The resonance stability has been split into these two categories, namely, [Torsional Resonance](/wiki/torsional-resonance) and [Electrical Resonance](/wiki/electrical-resonance).\n"
      }
    ]
  }
}
