{
  "$schema": "https://ps-wiki.github.io/schema/v1/term.schema.json",
  "id": "smart-grid",
  "title": "Smart Grid",
  "description": "A modernized electricity grid using digital technology to improve reliability, security, and efficiency.",
  "language": "en",
  "tags": [
    "smart-grid",
    "semantic",
    "european-union",
    "europe"
  ],
  "related": [],
  "breaking": false,
  "dates": {
    "created": "2025-12-02",
    "last_modified": "2025-12-02"
  },
  "authors": [
    {
      "name": "Jinning Wang",
      "url": "https://jinningwang.github.io"
    }
  ],
  "content": {
    "sections": [
      {
        "order": 1,
        "id": "definition-in-an-act",
        "title": "Definition in an Act",
        "type": "definition",
        "source_keys": [
          "eisa2007"
        ],
        "page": "p294",
        "body_md": "> It is the policy of the United States to support the modernization of the Nation’s electricity transmission and distribution system to maintain a reliable and secure electricity infrastructure that can meet future demand growth and to achieve each of the following, which together characterize a Smart Grid: \n>\n> (1) Increased use of digital information and controls technology to improve reliability, security, and efficiency of the electric grid. \n>\n> (2) Dynamic optimization of grid operations and resources, with full cyber-security. \n>\n> (3) Deployment and integration of distributed resources and generation, including renewable resources. \n>\n> (4) Development and incorporation of demand response, demand-side resources, and energy-efficiency resources. \n>\n> (5) Deployment of ‘‘smart’’ technologies (real-time, automated, interactive technologies that optimize the physical operation of appliances and consumer devices) for metering, communications concerning grid operations and status, and distribution automation. \n>\n> (6) Integration of ‘‘smart’’ appliances and consumer devices. \n>\n> (7) Deployment and integration of advanced electricity storage and peak-shaving technologies, including plug-in electric and hybrid electric vehicles, and thermal-storage air conditioning. \n>\n> (8) Provision to consumers of timely information and control options. \n>\n> (9) Development of standards for communication and interoperability of appliances and equipment connected to the electric grid, including the infrastructure serving the grid. \n> \n> (10) Identification and lowering of unreasonable or unnecessary barriers to adoption of smart grid technologies, practices, and services.\n"
      },
      {
        "order": 2,
        "id": "definition-first-being-documented",
        "title": "Definition first being documented",
        "type": "definition",
        "source_keys": [
          "paulo2025smartgrid"
        ],
        "page": null,
        "body_md": "> The term “smart grid” emerged in public technical documents at the end of 1997 and was pioneered among other individuals by Dr. M. Amin, while he was at Electric Power Research Institute (EPRI), USA. This vision encompassed the integration of sensing, communication, control, automation, and cybersecurity across the entire energy system—from fuel source and generation to transmission, distribution, and end-use. The initiative developed several enabling technologies, including fast look-ahead modeling and simulation, self-healing networks, wide-area situational awareness with actionable intelligence via phasor measurement units (PMUs), fast state and topology estimation, reinforcement learning, and adaptive, automated control systems based on AI. These breakthroughs aimed to transform the grid from a reactive system into a predictive adaptive infrastructure.\n"
      },
      {
        "order": 3,
        "id": "definition-by-the-european-union",
        "title": "Definition by the European Union",
        "type": "definition",
        "source_keys": [
          "ec2025smartgrid"
        ],
        "page": null,
        "body_md": "> Smart grids are energy networks that can automatically monitor energy flows and adjust to changes in energy supply and demand accordingly.\n"
      }
    ]
  }
}
